{
  "exclusions": {
    "generated_release_assets": true,
    "manifest_self": "rapp-release-source-manifest.json",
    "private_and_runtime_state": true,
    "repository_metadata_and_caches": true
  },
  "file_count": 380,
  "files": [
    {
      "executable": false,
      "mode": "0644",
      "path": ".editorconfig",
      "sha256": "882de30e043bf99dbf953aa8c4c0a5e3455e010bb41001a7957e2fea6d09170a",
      "size": 281
    },
    {
      "executable": false,
      "mode": "0644",
      "path": ".gitattributes",
      "sha256": "9aff1d76210ba0ae6f1358aedc360e0c2c241a10eacb0df1811cfdfb7173e7df",
      "size": 268
    },
    {
      "executable": false,
      "mode": "0644",
      "path": ".github/workflows/ci.yml",
      "sha256": "db17d96c6b8812c1cc831cbc226d590b18b71c67237a8e5756e26ff78bc6a525",
      "size": 4321
    },
    {
      "executable": false,
      "mode": "0644",
      "path": ".github/workflows/pages.yml",
      "sha256": "b42744731794e305e80eeacb42da5b040e6611845ddd6bbf059bd880fd2ccecc",
      "size": 18843
    },
    {
      "executable": false,
      "mode": "0644",
      "path": ".github/workflows/promote.yml",
      "sha256": "851a1319ac210343e3731e4cdc3df7a5c76289b733f4f89a5f441a56892781e7",
      "size": 15288
    },
    {
      "executable": false,
      "mode": "0644",
      "path": ".github/workflows/release.yml",
      "sha256": "b4f953050ff837ed48959c14003af5e12ac6b19211f697fa77b9186afcd22565",
      "size": 20602
    },
    {
      "executable": false,
      "mode": "0644",
      "path": ".gitignore",
      "sha256": "6575df1d305dd51702fbd2736e7801d190779ec4dab76481807b16cce19b6630",
      "size": 544
    },
    {
      "executable": false,
      "mode": "0644",
      "path": "AI_CONTEXT.md",
      "sha256": "d43c5fabdf6e6d88f4331a64d7ee9f72f6b3d8e5d7c441f60716bca603e19b94",
      "size": 11272
    },
    {
      "executable": false,
      "mode": "0644",
      "path": "CAPABILITY_MATRIX.json",
      "sha256": "d97b40cf8e14465dfb944e947131f0999baf34880cf6b46c44bec0a437b1558a",
      "size": 236307
    },
    {
      "executable": false,
      "mode": "0644",
      "path": "CHANGELOG.md",
      "sha256": "1b899f39aee7f439415fb9281d3edf214871442f5d44fe3b6c93f359a0822072",
      "size": 9798
    },
    {
      "executable": false,
      "mode": "0644",
      "path": "COMMAND_MANIFEST.json",
      "sha256": "bfca932a3d8c1d4b785d37622573fc80d05ecc6c7fa4d29ba9b9abc63c068bee",
      "size": 86711
    },
    {
      "executable": false,
      "mode": "0644",
      "path": "CONFORMANCE.md",
      "sha256": "9f2177507b430b8468c25acf50957aff81811fe678388691f174d24063c6b139",
      "size": 13299
    },
    {
      "executable": false,
      "mode": "0644",
      "path": "CONTEXT_INDEX.json",
      "sha256": "e0ea17b095d51df67cc58584c85906ada0af171e083fa4e3e72fc4863354ddab",
      "size": 203246
    },
    {
      "executable": false,
      "mode": "0644",
      "path": "CONTRIBUTING.md",
      "sha256": "fba9bf52569675ada326d8dbdc5b1ea2133f63b570592fc93df3d3089dfbfcbd",
      "size": 2480
    },
    {
      "executable": false,
      "mode": "0644",
      "path": "DEPENDENCY_LOCK.json",
      "sha256": "3858fd9ad34ace8655a502821e3853e5903ce99c127ad10a5e6f6f744feae37d",
      "size": 7002
    },
    {
      "executable": false,
      "mode": "0644",
      "path": "GITHUB_ACTIONS_LOCK.json",
      "sha256": "46e2a853102c92a192adee00e454505ec2eca88d059ab00d203aa474ed3664cd",
      "size": 4383
    },
    {
      "executable": false,
      "mode": "0644",
      "path": "LICENSE",
      "sha256": "fca150ce338dbcf5a0e3fd0b5446c4674556b1a4432425105b9c01c661cd9a72",
      "size": 1071
    },
    {
      "executable": false,
      "mode": "0644",
      "path": "LIVE_PROVIDER_STATUS.json",
      "sha256": "58e338adc4f9317734eab9dfb5a096fb520393f1c1ad5305a372baeeab748c5f",
      "size": 323
    },
    {
      "executable": false,
      "mode": "0644",
      "path": "Makefile",
      "sha256": "a2bdedfd429fc6f0e4a1fa143fa64d2f739e0a3df948f40ab1d7b4f0ca2125be",
      "size": 1034
    },
    {
      "executable": false,
      "mode": "0644",
      "path": "NOTICE",
      "sha256": "1fa7954abf4451de33a1f2ad100bd34a6d360fb09c6fa2b015afa021314ba8a9",
      "size": 7074
    },
    {
      "executable": false,
      "mode": "0644",
      "path": "PROVENANCE.json",
      "sha256": "bbbaa548fc3999ffb79eb50a90f2740388d6f7b4b37fe4d8196ac441be8c13df",
      "size": 170512
    },
    {
      "executable": false,
      "mode": "0644",
      "path": "PUBLICATION_SCAN_POLICY.json",
      "sha256": "68a5dec425e622fff9af9c12967e52a9a6216b5b18702ddcd9882cd1ea37ed65",
      "size": 34044
    },
    {
      "executable": false,
      "mode": "0644",
      "path": "RAPP_END_TO_END.md",
      "sha256": "d7173608445a0629e13b760831a80357c95617ef503ff8c52d552f25a7d147bc",
      "size": 44475
    },
    {
      "executable": false,
      "mode": "0644",
      "path": "README.md",
      "sha256": "0a80fc77ee6acba34c7076733fe09f3cf97c5700663acb3bdd6090ffe9a4cac0",
      "size": 15902
    },
    {
      "executable": false,
      "mode": "0644",
      "path": "RELEASE_CHECKLIST.md",
      "sha256": "a25c7c7c20fc557c4dd1bab2bf2fc5c1f395bff15f732026d61a69f8b7f4423d",
      "size": 5268
    },
    {
      "executable": false,
      "mode": "0644",
      "path": "RELEASE_STATUS.json",
      "sha256": "e725ef3e732a87ccc200a0c7641c59ece404474ad608ec40b613cb0136eb9f3e",
      "size": 457
    },
    {
      "executable": false,
      "mode": "0644",
      "path": "RELEASE_TRUST.json",
      "sha256": "04e804a1b9008cdb395bf134601d5686cd5dc70f74d805c4e20c37d2d7fcb623",
      "size": 466
    },
    {
      "executable": false,
      "mode": "0644",
      "path": "SBOM_INPUT.json",
      "sha256": "5f993d4aded08fe3e3c0436a26073c9c6e2fa15a33595b7ffea7f3ffa8f23ee8",
      "size": 5508
    },
    {
      "executable": false,
      "mode": "0644",
      "path": "SECURITY.md",
      "sha256": "7885a2a008e1abf0b813d171333422ac13570d3d83130f476c573d4b55ac8ab4",
      "size": 6187
    },
    {
      "executable": false,
      "mode": "0644",
      "path": "SOURCE_CENSUS.json",
      "sha256": "395ca4535f54fde1551d5547400a4643c8e26786f20f3eda0d24d1c9c46d0b90",
      "size": 648012
    },
    {
      "executable": false,
      "mode": "0644",
      "path": "STACK_LOCK.json",
      "sha256": "7b4c59c39a0d7f8f8b33d22dab2765758df84f740e5a32d608e3ab4122916e27",
      "size": 69390
    },
    {
      "executable": false,
      "mode": "0644",
      "path": "STORE_INDEX.json",
      "sha256": "a17efbf9929862fc41f3517f7720ae73f179754ef92d257102e3ca05229b26c4",
      "size": 437
    },
    {
      "executable": false,
      "mode": "0644",
      "path": "SYSTEM_GRAPH.json",
      "sha256": "4c33678938c35a413cc521b00bfa8ecbb45d2e6ae4190272d0bd6b0f0b219887",
      "size": 327705
    },
    {
      "executable": false,
      "mode": "0644",
      "path": "THIRD_PARTY_LICENSES/OpenRappter-MIT.txt",
      "sha256": "36cd68bee0a4fe7b04ab936cd83e8edd65c4e1bfc37d21b8dfba243dc27bcfd9",
      "size": 1063
    },
    {
      "executable": false,
      "mode": "0644",
      "path": "THIRD_PARTY_LICENSES/imsg-MIT.txt",
      "sha256": "14293556b79940745123d0160c71d27ed0e9fe9b8a848093f3ed78f4853caafe",
      "size": 1074
    },
    {
      "executable": false,
      "mode": "0644",
      "path": "VENDOR_MANIFEST.json",
      "sha256": "a3f329404f9ddd620004b5ee17360d604b4fdf3b27593ee7e779b552f34729b5",
      "size": 537
    },
    {
      "executable": false,
      "mode": "0644",
      "path": "VERSION",
      "sha256": "1c008e65cd24b36babadc31ca13029c55fb2720d269a89e804adaefaf1946834",
      "size": 10
    },
    {
      "executable": false,
      "mode": "0644",
      "path": "birth.json",
      "sha256": "3107426e10df87456fc88cb2ac51c294954bf564ccc0aa13a9c0a4f881cdf94d",
      "size": 408
    },
    {
      "executable": false,
      "mode": "0644",
      "path": "cubbies/kody-w/agents/README.md",
      "sha256": "c81082ee3c152a4f2b4a3e590982349088c28762a176c56c14d3d52d543bba45",
      "size": 682
    },
    {
      "executable": false,
      "mode": "0644",
      "path": "cubbies/kody-w/agents/rapp_stack_cubby_agent.py",
      "sha256": "6318e300813e5f749ffbe030cc9a9f51ddef3c15657b947a72dd804eb5ceeef7",
      "size": 256120
    },
    {
      "executable": false,
      "mode": "0644",
      "path": "cubbies/kody-w/catalog/controller-catalog.json",
      "sha256": "22d502bc0f937e612192ad1c4a6abe2db08cad86c06ae37c02fa6004d982045b",
      "size": 1264
    },
    {
      "executable": false,
      "mode": "0644",
      "path": "cubbies/kody-w/catalog/controller-receipt-template.json",
      "sha256": "8347f96cdaedacaae440683e12bd82e496603ad6ee569bf9fb42ee1d1c9781e3",
      "size": 1049
    },
    {
      "executable": false,
      "mode": "0644",
      "path": "cubbies/kody-w/cubby.json",
      "sha256": "03ef4c62810090386d8037f28d560a1f72ac148732b00069bad72b35e734e9c4",
      "size": 756
    },
    {
      "executable": false,
      "mode": "0644",
      "path": "cubbies/kody-w/rapplications/rapp-stack/README.md",
      "sha256": "84d1b6ed20d997ba8189b717aef72b60960cc372d08aa9299e9d8069bd3db23f",
      "size": 924
    },
    {
      "executable": false,
      "mode": "0644",
      "path": "cubbies/kody-w/rapplications/rapp-stack/index_entry.json",
      "sha256": "7edbf3bc2037aa65eb06dd3759a3e7601c55dac5477cdebf927704cb441cfea3",
      "size": 502
    },
    {
      "executable": false,
      "mode": "0644",
      "path": "cubbies/kody-w/rapplications/rapp-stack/manifest.json",
      "sha256": "2a44a4fe399d1666fb3ad764cabf2c3e7344c7eb1a2097b0a98bdff6b6924d60",
      "size": 4135
    },
    {
      "executable": false,
      "mode": "0644",
      "path": "cubbies/kody-w/rapplications/rapp-stack/singleton/rapp_stack_cubby_agent.py",
      "sha256": "6318e300813e5f749ffbe030cc9a9f51ddef3c15657b947a72dd804eb5ceeef7",
      "size": 256120
    },
    {
      "executable": false,